{
  "$schema": "urn:web-blink:schema:weblink:1",
  "schemaVersion": 1,
  "id": "com.banana",
  "version": "1.0.0",
  "name": "Banana example",
  "description": "Fictional read-only product listing. No session values, grants or executable scripts.",
  "artifacts": [
    {
      "role": "openapi",
      "path": "openapi.json",
      "sha256": "fd35674eb86a5956f8059dc17043a6d133a0e23d05f77432d3ecde8e34c51156",
      "mediaType": "application/json"
    }
  ]
}
